{"type":"config","name":"Optimizing tf-features Rust batch extraction for lowest runtime","metricName":"total_ms","metricUnit":"ms","bestDirection":"lower"}
{"run":1,"commit":"3ee532b","metric":0,"metrics":{},"status":"crash","description":"baseline setup with ignored Rust benchmark; crash due to PyO3 picking unsupported system Python 3.14 during cargo test build","timestamp":1773707093602,"segment":0}
{"run":2,"commit":"45ba9b2","metric":3.972,"metrics":{},"status":"keep","description":"baseline Rust benchmark harness for tf-features with fixed PyO3 interpreter selection","timestamp":1773707132664,"segment":0}
{"run":3,"commit":"52a817e","metric":4.26,"metrics":{},"status":"keep","description":"move Rust benchmark harness and checks onto dedicated autoresearch branch with pinned PyO3 Python interpreter","timestamp":1773707299798,"segment":0}
{"run":4,"commit":"687347f","metric":3.84,"metrics":{},"status":"keep","description":"optimize function word detection by replacing per-call lookup map construction with inline match helpers","timestamp":1773707402955,"segment":0}
{"run":5,"commit":"687347f","metric":0,"metrics":{},"status":"crash","description":"attempt single-pass Unicode metrics computation; crash from stale formality helper signature mismatch","timestamp":1773707474253,"segment":0}
{"run":6,"commit":"687347f","metric":3.882,"metrics":{},"status":"discard","description":"try single-pass Unicode metrics scan; runtime regressed slightly and gain is negligible, so discard and stop per user preference","timestamp":1773707531006,"segment":0}
{"run":7,"commit":"491cf1c","metric":3.661,"metrics":{},"status":"keep","description":"reuse precomputed char and token buffers across bigram and trigram extraction in ngram pipeline","timestamp":1773707699125,"segment":0}
{"run":8,"commit":"491cf1c","metric":4.839,"metrics":{},"status":"discard","description":"attempt to reuse lexical tokens for word ngrams in hot path; regressed badly, likely due different token shape or less favorable allocation patterns","timestamp":1773707767477,"segment":0}
{"run":9,"commit":"491cf1c","metric":3.675,"metrics":{},"status":"discard","description":"optimize ASCII token flush path with in-place lowercase and mem::take in lexical and ngram tokenizers; result essentially unchanged so discard","timestamp":1773707866576,"segment":0}
{"run":10,"commit":"a032985","metric":3.357,"metrics":{},"status":"keep","description":"specialize char and word bigram/trigram string construction to avoid generic collect and join overhead in hot ngram paths","timestamp":1773707946511,"segment":0}
{"run":11,"commit":"7f19c46","metric":3.163,"metrics":{},"status":"keep","description":"compute sentence metrics in a single pass to avoid sentence slice allocation and per-sentence tokenization","timestamp":1773708037920,"segment":0}
{"run":12,"commit":"7f19c46","metric":5.105,"metrics":{},"status":"discard","description":"attempt to fuse unicode metrics and punctuation profile into one scan; significantly regressed runtime, so discard","timestamp":1773708139920,"segment":0}
